{
  "id": "b7d7b3e3-3f2e-4b1d-971a-7c2fd9d9a9aa",
  "user_id": "0c9d1bc1-7b1a-41fb-84f2-9e2a1b01b6a4",
  "title": "Financial independence with creative work",
  "vision": "Earn with writing, media, and AI tools while keeping freedom.",
  "why": "Time autonomy, impact, and learning.",
  "categories": ["career", "finance", "learning"],
  "horizon": "life",
  "status": "active",
  "start_date": "2025-01-01",
  "target_date": "2030-12-31",
  "success_metrics": [
    { "name": "Monthly passive income", "target_value": 5000, "unit": "USD" },
    { "name": "Published works", "target_value": 24, "unit": "count" }
  ],
  "progress_percent": 12,
  "created_at": "2025-11-10T02:30:00Z",
  "updated_at": "2025-11-10T02:30:00Z"
}

